,nama,komentar,rating
0,T***o,"barang sudah sampai, tapi yang dikirim tidak sesuai warna nya. sisa nya ok semua tidak ada masalah.",3
1,wagiyah,ga dikasih free adaptornya,3
2,B***y,"nyesal beli disini lebih mahal terpengaruh ulasan dpt charger ternyata hanya HP dan kabel saja,harga lebih mahal dari toko lain.Hati hati terpengaruh ulasan,sudah kirim n... ",3
3,n***a,Pengiriman lama overall bagus,3
4,I***m,Keterangan promo benefit tidak detail dan kurang jelas.,3
5,A***t,"Untuk respon seller dalam pengemasan lumayan cepat, untuk barang sesuai pesanan, dan masih baru dan segel, top ğŸ‘ kekurangannya: respon chat menggunakan otomatis chat jdi... ",3
6,F***h,"biasa aja, ngirimnya lama transaksi siang tetep di kirim besoknya",3
7,AGUS,respon admin nya parah bgt lelettttt cuma ngandelin balasan otomatis cuman hp good lah g nyesel beli disini tapi admin kualitas jelek bgt,3
8,Susanto,"Barang nya bagus, pelayanannya huek..mau muntah. lelet",3
9,erni,"barang bagus,hanya pelayanan yg kurang.sekelas official store pelayanannya sangat mengecewakan.pesana tanggal 3 dan baru dikirim tanggal 6,itupun setelah mengajukan pemba... ",3
10,Gilang,"Barang bagus saya ga ada komplain soal barang, cuman pengiriman ini termasuk yang paling lama. Pengiriman super lama hampir 30 menit lagi pembatalan otomatis, di chat dar... ",3
11,Fata,"packing aman, tapi pengiriman toko lambat. Pesan jumat sore, baru sampe Rabu siang padahal nextday",3
